,asin,overall,vote,Category,cleanText
1747,B00KWHEGJ2,3,,Luxury_Beauty,div input hidden http input hidden http nbsp see video em michelle phan great cover ultimate concealer work great cover dark circle eye compare side look cake use cover blemish dark mocha color skin rule thumb suppose choose least one two shade lighter purchase concealer way neutralize dark area without unwanted attention way light use medium neutral spot correctors use foundation substitute always worn underneath foundation power apply finger use small em michelle brand feel velvety smooth dry satin powdery finish however find look smooth eye area wrinkle fine line look cake noticeable dark circle appear quick bit lighter skin even look smoother eye however area spot cover blemish acne dark spot look smooth look obvious use makeup hide blemish make great eye dark circle corrector look concealer treat problem area recommend product
1748,B00JUFIRYM,5,,Cell_Phones_and_Accessories,boyfriend iphone 6 plus snag always look phone use get navigation make nervous time get phone dash affix little effort able move around right spot easily hold steady since month complaint either pleased mount
1749,B00006F2EP,5,2,Video_Games,really flaw memory card buy two instead one alot good buy 2 seperately save buck thing 3 game use memory space might wand consider 32mb memory card codejunkies make
1750,B000VLI74Y,5,7,Appliances,since motor humidifier still work run vinegar twice replace filter operate good new least filter important reduce really fine white dust advertised way look old used filter know replace way one use two season
1751,B00064AEOC,5,,CDs_and_Vinyl,huge bowie fan first live bowie experience disappointed every bowie classic rendition pressure almost good original freddie turn turn enjoy
1752,B00000ADL9,5,3,CDs_and_Vinyl,new pushmonkey start cd band put independent album 1994 tour like madman 3 year song play year far best stuff lucky enough see lot show still buy album hear every song good pushmonkey fan give disc spin unfortunately hit big major label debut ca really tell great song maybe remake early song sweet carribean bungalow think mabye well check album maize original
1753,B00005AW1X,4,,Electronics,buy 16 year old daughter use basic toshiba 17 tv room tv use video game playback commercial tv get quite dvd birthday want able watch back unit perform well pretty basic unit talk pretty basic set two feature really enjoy 4x picture zoom 4 forward reverse scan speed multiple camera angle subtitle language select like foreign film feature work well easy use though lose side view picture zoom whole feel like get good value money happy lark unit ask
1754,B00080FK2U,5,,Clothing_Shoes_and_Jewelry,great fit round face hard time find glass dig cheek perfect happy customer
1755,B001IKJOLW,5,,AMAZON_FASHION,cute comfortable light receive today fit perfect normally wear 8 true size
1756,B00JC5Y4FQ,4,,Software,nice medium player play back various medium source complete stability user interface simple easy operate control intuitive pretty much impossible screw anything video quality seem excellent 1080p resolution notice quality difference medium suite picture clear crisp color expect playback less stellar default set default audio decoding handle powerdvd frankly send audio avr via hdmi horrible job separate audio channel center channel practically ignore audio send front leave right channel instead fix issue go audio setting set powerdvd send audio avr instead let powerdvd decode way avr able properly decode hdmi audio signal send proper speaker audio sound perfect run program less confidence inspiring work build medium library take nearly 8 hour complete powerdvd program would become unresponsive freeze extended period medium library build program run smoothly stably happy suite good job window medium center window pro tend buggy want play various medium source without computer restarts nonsense powerdvd play everything without hassle
1757,B0000668YX,5,,Electronics,belkin brand best use wall plug surge protection upgrade 6 plug swivel wall unit really like
1758,B00X3OH2WE,3,3,Sports_and_Outdoors,eleven year old daughter order since 5 weigh 84 lb try stretch somewhat still smallthe shipping time good top size need order adult extra smallthe material also thin
1759,800141660,5,,Movies_and_TV,love jane austen
1760,B00186NSGS,4,,Appliances,hard come worth
1761,B003HGHU8E,5,,Tools_and_Home_Improvement,good quality beat moody moody fan life
1762,B001AQEZ2W,5,,Industrial_and_Scientific,super amazing quality price read cheap model make igaging tech blog glad buy one super display mm decimal inch fractional inch smooth action drawback unlike straight ruler one ca easily estimate accurate may tell bolt hole nominal value accurately make hard measure inside nut opening small change might indicate british measurement rather metric fun learn use instrument almost like jewelry come nicely form case
1763,B00QUY4GUU,5,,Pet_Supplies,good quality love size
1764,B0000530HU,1,,All_Beauty,buy smell nice shave put smell awful 19 smell like grandmother much perfume
1765,B00VWKKHKU,4,,Cell_Phones_and_Accessories,affordable android phone would compare performance hardware wise nexus 5 phone currently term power button top phone convenient place take two hand turn phone someone use power button side awkward size wise people want small phone vein nexus 5 phone feel volume button back phone bad placement change volume lot bloatware uninstall asus launcher replace google launcher become easy use
1766,B00005Y404,5,,Video_Games,start play game think metroid samus play control may need little work consider test run sega smilbit successful test flaw overall say nintendo serious competitor gun valkyrie metroid sequel likely blow door mtroid samus aran well opinion go stand behind 100 samus aran kelly gun valkyrie 100 kelly awesome gv suit gv suit especially kelly evoluton 3 gv suit almost limit hope gun valkyrie 2 take full advantage every thing xbox offer
1767,B0015ZK0VI,4,,Pet_Supplies,work say suppose issue design well worth money people review say modify work suppose
1768,B00JYG7LIU,5,,Musical_Instruments,deliver time condition advertise great pick
1769,B00GTO6XU2,5,4,CDs_and_Vinyl,great set beware fake one still china could believe still make sell take proposition buy one fairly inexpensive seller ebay like 87 cuz want see real fake ebay get fake get money back come look fine factory seal authentic box sticker back cardboard piece proper barcode say make eu open sign bootleg come roar forth book fine page good print picture dark stain back dirt black ink ca tell wo come disc include miss disc fine cover artwork fade colour label wrong one shoulda bright red instead maroon wrong columbia font yellow white big giveaway thin flimsy round plastic bag insert cardboard cd holder anything wrong plastic bag protector never set cd first place yeah fully investigate set saw red flag call ebay explain demand money back get weekend thing look ok distance play fine good sound would fine casual cd listener collector would care little detail u dress fake look authentic certain thing ca hide thing fake like turd pig dress look nice put lipstick still music body work stand alone 47 disc thing discover deserve authentic package hang onto get real one fun comparison chuck attempt sell catch get new one thing toss disc use extra box tchotchke beware fake chinese seller 5 star music real box zero fake
1770,B0102GSBYS,2,2,Automotive,warn chemical guy brainiac packagers put sticker towel peel without leave sticky residue
1771,6300213714,4,,Movies_and_TV,first see movie young see available decide watch still keep attention
1772,B000SQP4OS,5,,Prime_Pantry,stale
1773,6300215628,5,,Movies_and_TV,love old movie good clean fun constant swearing sex violence good story even teenager enjoy
1774,B000089V7W,5,,Clothing_Shoes_and_Jewelry,saw used pair price could pass arrive look brand new happy purchase size seem true grandson wear 7toddler order fit perfectly show sign discomfort fact want wear shoe would definitely buy another pair love much would recommend
1775,B000068O49,5,,Electronics,use adapter hook jbl lsr305 studio monitor pioneer 50 plasma via left right unbalance 1 meter rca cable problem increased hiss noise floor jbl superb
1776,B006H9WBWI,5,,Kindle_Store,author write beautiful love story full romance suspense read love anoutlaw story love storyline hold attention end hate book character well write enjoyable highly recommend book others author write
1777,B0034KBUAM,5,,Digital_Music,know hate think glam flash get great voice song perfect work gym run clean house cruise highway modern madonna course like madonna song great beat look work
1778,B00VZAMAAC,5,,Sports_and_Outdoors,advertised quickly ship
1779,B004X29R8M,5,,Kindle_Store,enjoy series write perspective movie star go zombie apocolypse
1780,B00W4XMEXC,5,,Luxury_Beauty,baxter california product skin personal care quality stuff really justify price item would make perfect holiday gift man life men judgment whatever ingredient use feel great skin little aroma simple clean masculine
1781,B000KITQNY,5,,Musical_Instruments,need pedal balance level bass low boom come hot high quiet less prominent pedal enhance feature give exactly need without loss tonal quality quiet unless turn volume loud use much enhance happy issue bit flimsy make plastic plan keep time wo step often great job behringer 25 best price market
1782,B00PUZFKYG,5,,Arts_Crafts_and_Sewing,like canvas say basecoated add another coat start use acrylic dry fast work nice price right perfect little magnet sign fridge plate stand mantle dresser
1783,B00IHBSWH2,5,,Digital_Music,anything love love love love
1784,B000051WW9,5,131,Electronics,use week read post regard player let make recommendation regard use playe especially people problem player pros 1 price incredible price get 2 battery life play least hour mp3 pair rechargeable battery supply memorex 3 read id3 tag support 4 45 second esp shock protection 5 read cdr cdrw 6 acceptable sound quality 7 read mp3 file 192 kbp even though manual say 128 kbp 8 true random file playcons 1 awkard user interface 2 even awkard manual ashamed english chinese first language 3 backlight 4 resume work player power 5 support 256 kbp filesmust read section 1 problem frequent click skip middle playing skip minimum shake return player defective happen first player return get second one revised edition flip player see little sticker say suffix mean revised edition skip shake eliminate play greatly reduce though 100 go 2 thoroughly test mp3 file computer first make sure contain pop click 3 make sure use direct cd burn mp3 disc mention many time 4 easycd creator simply good program use burn mp3 easycd support level 1 format support 8 character burn disc nero nero support level 2 basically iso9660 level 2 format support file name long 8 character level 2 mpd8505cp display first 12 character file name file name artifact associate level 1 joliet solution file name problem people 5 currently experience 700mb cdr cdrw test post thought
1785,B0091JKJ0M,5,,Gift_Cards,like amazon gift card always time allow folk large variety item pick get really want gift card
1786,B0126T38PG,2,,Prime_Pantry,cheap reason flavor texture underwhelming sure cut meat fine nothing excessive fat connective tissue weak flavor bring camping trip one really enjoy brand dud shame saw sweet baby ray would best like sauce
1787,B00MX4O9DU,5,,Cell_Phones_and_Accessories,love case strong cheap protective phone love phone case one favorite far recommend case everyone tuff otter boxbut cheap
1788,B015TYDZTE,4,,Prime_Pantry,get expect
1789,B00W259T7G,5,,All_Beauty,soap smell absolutely wonderful could smell open box ship overpower fragrance invite one make want unwrap go take shower funny soap overscented artificial smelling fragrance others natural fragrance ca get enough soap definitely later perfect soap someone like morning person shower make feel good put smile face even early morning make want linger shower experience fragrance good thing shea butter enrich keep skin feel dry even hot soap lather really well seem fairly hard mill since shrink fast even repeat use
1790,B00GU8W5AE,5,,Video_Games,highly recommend consider option play mmorpgs certainly necessary however give edge v keyboard look directly keyboard could also change button scheme purposely need add action need daily gaming purpose play mmos ffxiv shortcut perform combination highly recommend play high skill level especially pvp
1791,B00B77UW5I,3,,Cell_Phones_and_Accessories,order leather case ok price though like executive leather black white stitch belt clip pouch well
1792,B0007QA0UW,5,,Pet_Supplies,well make kong rubber toy make usa dog love fetch bounce erratically also enjoy regular dry dog food place deep slit since food flat slit shallow like play pull piece work chew kibble also toy perfect size 9 lb havanese past puppy teething regular red rubber kong wish sooner still toy like describe
1793,B000PV3S9E,4,,Toys_and_Games,purchase item preschool class unit transportation think would nice addition center fine magnet stick well almost well complaint toy size small piece extremely small want something tiny throw purse diaper bag keep kiddo entertain restaurant perfect much small classroom use
1794,B001IKJOLW,4,,AMAZON_FASHION,cute comfy sleek design complaint fly wire loosen shoe sometimes slip heel heavy sled run two pair style
1795,B0002E2SA4,4,,Musical_Instruments,decent pick always look cool jazz iii pick good small work great first year guitar
1796,B01HFP55AW,5,,Cell_Phones_and_Accessories,item come package well never let phone go without screen protecter clumbsy one constantly drop phone screen protector good case never actually bust phone mine screen protector make nicely put easy fit perfect s7 active confident protect screen drop would recommend product others receive product free discount honest unbiased review
1797,B000MARL8M,5,2,Arts_Crafts_and_Sewing,sharp easy use small enough little cut paper also like blade
1798,B001AD6T24,5,,Automotive,love perfect size need fit six pack cooler middle compartment end expand extra storage
1799,B00J7YQBSA,5,,Cell_Phones_and_Accessories,best screen protection
1800,B00DMNHAV4,5,,Sports_and_Outdoors,buy 50 tree stand last season serve well last year year tree stand start squeak make kind noise inspection turn one cable loose stand look sort alignment upgrade millenium glad quality item installation super easy thanks proprietary attachement system use one season thus far tell difference term comfort 4 hour wood problem squeak noise perfect recommend add thermal cushion cold condition fabric seat let cold air blow behind spend extra 5 small cushion
1801,B00DM8J11Q,5,,Appliances,good dog
1802,B0007T1ANK,5,,Clothing_Shoes_and_Jewelry,wife wear year slipper like
1803,B0014C227W,5,,Video_Games,another old favorite game able add back collection enjoy play fun addict jewel
1804,B004IKEKWC,5,,Software,easy install fairly unobtrusive consume inordinate amount resource interfere proper functioning program computer notifies attempted attack computer necessary evil day age
1805,B00F2B3M2A,5,,Toys_and_Games,grandson love car play time complaint little loud
1806,B003B1ZHFS,5,,Office_Products,lot ticket little cash
1807,B00OBZI7BY,5,,Video_Games,tetri love hubby birthday thank rapid shipping wrapped ready
1808,B00ZGQD4GU,5,10,Office_Products,love gel
1809,B001685KSM,1,,Arts_Crafts_and_Sewing,button 2 2 buy 2 inch punch print 24 circle fit punch never think button would small also cheaply make would still use picture would fit waste time money
1810,B007E5Y8U2,5,,Video_Games,nephew love game great price
1811,B000IJ7RQ8,5,,Magazine_Subscriptions,great magazine quick review movie tv music take away yhe
1812,B00004RC6R,5,,Home_and_Kitchen,use one several decade keep use long pop corn hate microwave popcorn friend never popcorn actually pop outside microwave think tasted good think hoot watch pop great product
1813,B00MCELKVU,5,10,Office_Products,try every wire cable system far right size slightly big nbsp bluelounge cabledrop black cable management system nbsp actually stick really well one come almost instantly slight movement hold two cord instead one great organize multiple wire actually replace need nbsp quirky cordies desktop cable management power cord charge accessory cable black nbsp good always slide around fell like nbsp command medium cord clip nbsp look ugly stick right pain latch around cord mudder easy clip try get cord always try turn mess cord something reasonable home work typically fail help make thing little easy definitely save minute lifetime chasing cord fall behind thing
1814,B003AN1UA8,5,2,Automotive,work expect take bit install overwhelming word caution put line use inverter style generator take extra time add switch could run inverter without damage bat determine turn air voltage drop 104 volt shutdown reason low voltage run rv 12 gage 40 extension cord swap 10 gage 50 well still drop 109 volt air led light
1815,B001NB8LV0,5,,Digital_Music,besides eminence front behind blue eye wo get fool favorite song like call tension dynamic listen song song great timeless song never get old tiresome
1816,6300216977,5,,Movies_and_TV,great movie great act wonderful music filming plot pure
1817,B005BFMG88,4,,Patio_Lawn_and_Garden,blower work fine quite powerful would like fine light duty still would consider good value time carefully read assembly instruction choose blower benefit couple improvement since assembly instruction print result spending little time look torx screwdriver would need attempt align notch longer blower easy start use cruise control handy feature would still buy unit could probably run 10 minute
1818,B00YS401X0,4,,Tools_and_Home_Improvement,great little vise would appear issue loose pivot fix vise tighten work
1819,B000QNZNNA,5,,Digital_Music,great old school song
1820,B00AYNG9BC,5,,Digital_Music,great show great soundtrack
1821,6301413024,3,,Movies_and_TV,act great
1822,B0078EPBHI,5,,Gift_Cards,perfect thank
1823,B001JTFPFQ,4,,Tools_and_Home_Improvement,great need thin bumper
1824,B00005NIPX,5,3,Magazine_Subscriptions,intelligent fashion magazine treat fashion lover like idiot great depth article screenplay celebs charity politics course fashion duh
1825,B00005N7RD,5,,Magazine_Subscriptions,husband love magazine lot good info repetitive maybe sometimes need reminder
1826,7102623,3,2,Books,bother one iota mr morris chose invent narrator character ronald reagan life interesting device provide different perspective mr reagan enigma person generation like even hear people talk president vagueness like person really would like find personality make tick hollywood get leader world opaque personality nothing would tedious read biography reagan dry sandpaper list fact like number think author try give u sense character man like think morris succeed moderately however find many section book deal fictional life narrator imaginary conversation pal subject remotely connect ronald reagan distract book eventually skim read passage find frustrate think morris editor look elsewhere consume panic narration technique fail take decent red pen text merit another critic find end book want know enigmatic mr reagan fear buy one sandpaper book order real shame otherwise think mr morris deserves praise present view mr reagan u might otherwise would recommend book anyone certainly experience look nut bolt biography every little fact throw biography
1827,B00CPGMUXW,5,,Patio_Lawn_and_Garden,work great clean patio shed
1828,B00U48I4NS,5,,Sports_and_Outdoors,product awesome use abnormal manner work perfectly homework tracker day teen use wristband log homework due date along assignment turn inproduct rec discounted rate exchange honest review
1829,B0029T0S70,5,,Automotive,love towel wash micro fiber material dry dryer gently ring hand hang still water leave interior clothes rack
1830,B01E4QUN0W,5,,Gift_Cards,buy many amazon gift card christmas person receive shop anything want fight crowd cold snowy weather well receive everyone
1831,B001AFD20E,4,6,Software,rosetta stone program good quick fast intro language especially casual visitor use previous version help learn enough french get frequent visit paris business son use version support school french class find helpful get quickly point learn basic break french improve pronunciation accent son similar wary company hype equivalent immersion program learn language etc nonsense fact find lack help understand french grammar completely inadequate sometimes help understand french use mean good dictionary essential know language culture find necessary ask question french colleague proper idiomatic cultural us various word phrase
1832,B005XUHH8A,5,,Tools_and_Home_Improvement,love leveler untill lose week later
1833,B000JCGU8U,4,,Industrial_and_Scientific,excited spray toxic stuff house get work seem exude smell least get close find hinge cart stuff creaky cranky careful press pump release ample amount use sparingly little lube hinge move part
1834,B0008EOAZO,2,,Clothing_Shoes_and_Jewelry,margin error need 37 breath
1835,B0009RF9DW,5,,All_Beauty,use bellmira herbaflor herbal bath year relaxing bubble bath best ever water hard stuff still make bubble like ever find scent mild must try
1836,B006LPO9QE,5,,Kindle_Store,movie buff game keep real question fun game user friendly would recommend game friend kindle
1837,B00ARJOWG2,5,,Industrial_and_Scientific,stand perfect burette tube diameter stable sturdy enough
1838,B001DZQYJW,5,,Sports_and_Outdoors,light weight east use perfect size use aluminum foil underneath turn black bottom fire work like charm
1839,B0009RF9DW,5,15,All_Beauty,allergic lot thing occasionally get red rash body use body wash one exception single complain perfect
1840,6300252310,4,,Movies_and_TV,nice dvd interesting bonus material like big monster movie give try
1841,B003OGV7UO,5,,Luxury_Beauty,pretty color hint shimmer
1842,B00DJU340G,5,,Musical_Instruments,look great bass make cello violin let
1843,B000VLZCEW,3,,Software,mix feeling product bail c disk crash however many issue software give example support problem practically non existent help forum people issue crash happen little hope would work switch different back buy software want backup history month go back old file make sort mistake hope run full back week differential back 6 time week way could fit 7 different backup large disk designate backup software claim function allow delete old backup base condition disk full example never work many people complain problem disk become full simply stop back remember manually free upgrade next version software suppose problem fix however fix remove functionality want possible new version still problem incremental backup disk full situation fact leave double amount space necessary one backup forum indicate need temporary space backup work finally solution work full back every day rule previous copy delete new backup create occasionally would still fail message make sense could get work sometimes delete several backup run disk defragmenter always help day would begin work felt fragile various issue contact support several time support via email would get back week request additional log file would respond maybe another week whatever say relevant could wait week possibly helpful response would wipe backup start regular backup felt flakey also create secure zone back option backup separate partion disk crash restore secure zone overall use frustrating experience share large number user base forum posting forum place could get idea possible solution validation problem unique positive thing product1 feature allow mount back easily retrieve old file another volume nice2 backup fairly quick try use window native back disk even complete 24 hour acronis backup disk complete overnight work would sit prompt complain something inscrutable finally disaster struck c drive crash able restore c drive backup brand new drive work reinstall window setting customization line option require constant need manually check work daily basis delete file pay constant attention want backup enable forget need
1844,B00G2TY2IY,5,,Arts_Crafts_and_Sewing,great little tool save lot time effort
1845,B001IKJOLW,5,,AMAZON_FASHION,daughter love great fit
1846,6300248097,3,,Movies_and_TV,long since watch film love romance stone jewel nile lack romance stone okay
1847,B00TTQM9A0,5,3,Musical_Instruments,ca go wrong shure
1848,B002RNYAHM,5,,Grocery_and_Gourmet_Food,yummy addictive
1849,B00005N7R0,5,3,Magazine_Subscriptions,love magazine like travel go figure love read travel learn interesting fact different location magazine definitely caters luxurious end lot review information villa private island resort etc also quite bit lot place information actually make move island information local tradition custom etc magazine equal part interest information actual useful tip vacation planning
1850,B00005853Z,5,,Electronics,easily popular trackball history trackball ergonomic well least righties button well lay accurate great daily use graphic art game recieved nothing accolade since release ton people still want people want would old stock still sell 100 please microsoft please beg classic device hear rumor even see picture updated version official word make please please least small quantity come updated version sell well promise
1851,B004LWOJC8,5,,Grocery_and_Gourmet_Food,great snack u ca keep around constantly order multiple time planter seem best tasting cashew try continue reorder price seem reasonable well
1852,B00006L9LC,5,,All_Beauty,love shampoo conditioner wonder hair enjoy use
