,asin,overall,vote,Category,cleanText
2460,B00000630Z,5,15,CDs_and_Vinyl,source live performance opening night new visconti production anna bolena la scala milan april current standard mono sound boxy limited standard calla record live performance well average voice generally sort way orchestra slightly less audience la scala open night unusually quiet italian crowd perhaps little awed occasion certainly unfamiliar opera recorded response positive generous less appropriate spot aside anyone listen anna bolena performance sound anna bolena queen england maria calla soprano enrico viii king england nicola giovanna seymour queen anna king mistress next queen england giulietta simionato percy nobleman dangerously love anna gianni raimondi tenor smeton young page musician idiotically love anna gabriella carturan soprano lord rochefort anna brother talent wrong place wrong time plinio clabassi baritone lord hervey courtier acutely aware career advance anna friend luigi rumbo baritone conductor gianandrea gavazzeni orchestra chorus teatro alla scala libretto english translation short history opera brief summary second major production anna bolena modern bel canto revival substantial cut role percy great sufferer many reviewer clearly suffer vapor thought lose single bar golden legacy among number sometimes less actually seldom find performance especially canto ornamentation create spot offer markedly improve artistic experience sometimes horrifying example complete tale hoffmann dismal downer case shortened text anna bolena work well enough anna bolena premier la scala december 26 1830 big hit catapult old composer great bel canto triad rossini bellini success opera share general collapse bel canto fortune lay dormant 1950s war ii era saw revival bel canto repertory largely drive presence maria calla subsequent development group diva combine enormous power extraordinary vocal agility century find amid drought diva next great medea lucia norma anna bolena find almost certainly among troop handel specialist come pour today academy libretto anna bolena rest lightly dreary historical fact anne boleyn conceive fairly typical bel canto heroine even extent grant short mad scene reputation henry viii completely slag librettist romani telling tale king single vestige honor generosity loyalty lack even make shakespeare monstrous richard iii entertainingly part receive lore among opera fan role anna voice killer norma say turandot isolde ca say whatever danger voice calla 1957 match fan la divina quite properly regard one great triumph critic hand profess detect early crack noble vocal facade perhaps one choose ignore virtue performance search well support rest cast often case live recording nicola somewhat wooly voice one great singer twentieth century good one nevertheless saw san francisco couple time toward end career solid performer could carry audience simionato much singer sound like despite oddly offhand dismissal find review publish good grey gramophone magazine year later describe anna bolena highlight career gianni raimondi sound fine remain part percy although would doubtless argue proper type voice role argument could make calla despite insistence fan remark critic stendahl first anna giudita pasta show something nineteenth century calla singer small role orchestra chorus conduct uphold reputation la famous live performance decent sound calla full la five star course
2461,B0007TC9LW,5,,Automotive,work 99 f250 superduty
2462,B00MYXTCIM,5,,Software,fourth year use turbotax home business love first start use find could use fill city tax form form need supply turbotax cheap pay tax preparer use accountant tax first year go business want deduct something would deduct deduct something approve realize file charge 500 turbotax could receive much large refund could save cost tax think turbotax awesome
2463,B001L8NGJ2,5,,Musical_Instruments,nice latch footswitch
2464,B006WX7Z66,2,,Grocery_and_Gourmet_Food,good hellman watery
2465,982697813,5,,Software,glo premium fantastic piece software everyone casual bible studyist dedicated student also valuable resource teacher preacher program stable well think easy navigate pack full feature make incredible value glo premium instal quickly easily homebrew vista x64 intel core i7 system full install take less 15 minute start finish use 3 disc provide glo prove provide new way study bible digital age give streamlined efficient approach learning explore bible would take hour longer manually multiple material via reference book highly recommended
2466,B00166DR5C,1,,Office_Products,real chine product vary hard assemble case impossible comfortable want move need pick chair come chip torn chair put together staple give vary professional look go far ill never buy product company sound unbelievable see
2467,B00003CWDG,5,2,Electronics,concerned price think item could regular quality good feel safe monster great company high quality standard
2468,B00JGTUQJ6,5,,Appliances,filter function taste exactly like expensive brand
2469,B00TST1SM8,5,,Patio_Lawn_and_Garden,perfect size garden tool
2470,B000H9QG5C,5,,Industrial_and_Scientific,nice quality price
2471,B000TG530M,5,,Video_Games,favorite cod ever make ca afford get remastered
2472,B006ZKQ846,1,,Toys_and_Games,rarely rate thing poorly amazon item really disappointed first set miss large start ramp domino box figure could still fun everything else box realize neither race car loops work launch mechanism connect latch suppose hold place look closely launcher certain design faulty basically leave box junky lightweight small domino none item advertise part set work domino really junky son excited set domino christmas morning quickly realize shoddy set felt terrible felt rip total junk consider warn
2473,B000INCK4I,5,,Magazine_Subscriptions,love magazine
2474,B0079Q0HU6,3,,Kindle_Store,find story interesting young girl father favorite go form humble beginning europe live luxury usa felt author leave many real detail true life prior arrive america unique story
2475,B00006XXGO,1,,Clothing_Shoes_and_Jewelry,order size 9 seem 10 large
2476,B000NCTOUM,2,,Appliances,cheap
2477,B000C9SL7I,5,,Automotive,use resistor block fix blower 2006 chevy colorado speed work
2478,B0170JL9A8,4,,Tools_and_Home_Improvement,good design 3 toilet fairly easy install wish come gasket bowl seat
2479,B01DG1N6E6,5,,Office_Products,good quiality
2480,B0002M34U4,5,,Clothing_Shoes_and_Jewelry,great product
2481,2238594,4,2,Books,good book kind book spend long time read even schedule reading would fall behind stop read like many book really interested well really pick around page 600 lot political affair description military tactic probably bore people enough stop reading end pace story get faster however find become aggravated could stand splitting dichotomy mind eye reel technical fact political background flawless perfect make whole book sound real throughout clancy could say president pet monkey believe good ethos near end book carefully describe political character become annoying work fiction become hope ruin book anyone end character become plain stupid imagine reading 600 page fairly intelligent people goal aspiration suddenly become mindless unable think act clearly course major opinion part find way character act near end impossible believe frustrate fit character action positive point however read lot respect people serve armed force clearly give good perspective life military like rank commander chief chain command try follow superior dialogue entertain character interaction believable tom clancy could away constant reference woman every 60 page disappoint book look forward movie hope little bit entertaining
2482,B01F6UTLIK,5,,Prime_Pantry,love eat
2483,B00Z8FYDZU,5,,Prime_Pantry,one best mascara use try dozen include expensive department store brand wear mascara get ask time whether lash real whether lash extension absolutely love mascara wo use anything else
2484,B0078EPRPE,5,,Gift_Cards,easy use
2485,B00R2O4YJU,5,,Prime_Pantry,man good
2486,B00D3YEGQ4,5,,Automotive,oh gosh absolutely love license plate frame great quality packaging come tiffany co sun hit color amaze also come extra hardware stone love bling disappoint
2487,B00NTQFV3S,5,,Cell_Phones_and_Accessories,great product well make
2488,B00025K10W,5,,Pet_Supplies,great deal flea control far good give daily dog food flea prevention cheapest one safe method prevention
2489,B00JDQKFPC,5,,Gift_Cards,good gift come nice box
2490,B0006U695E,5,,Clothing_Shoes_and_Jewelry,jean perfect slim man life
2491,B00006L9LC,4,,All_Beauty,shampoo conditioner leave hair great condition start use tell whether stimulate hair growth
2492,B00JH1W452,3,,Digital_Music,come michael jackson make voice way make dance many singer entertainer one kind yet pass 5 year ago remain one deviating loss time still music legacy live well yet cavalcade unreleased song able deliver instead feel much weak voice heart well love never felt good lead song upcoming escape album able deliver try harken much rhythm justin timberlake one many inspire michael jackson actually deliver song consider michael final record invincible release justin still part really fan song new michael jackson music consider song release still
2493,B0009RF9DW,5,,All_Beauty,smell wonderful lather nicely like andalou product know good skin work well purchase many skin product company like quality
2494,B000PAMDIW,3,,Patio_Lawn_and_Garden,pay red handled version shovel might heavy shovel ever pick look homemade like make metal shop class business end look crude quite finish edge tip feel pretty confident metal part long life experience handle generally first go break surprisingly handle shovel look like every fiberglass handle 40 really hope miss hidden something revolutionary inside handle sort concern add receive absolutely nothing limited warranty concern big time sure long bully tool business around inevitable time come concern lack warranty info get nothing amazon ad say limited warranty see explanation know mean hunch minimum guess customer sol come return shipping cost piece battleship metal mention keep cardboard shovel box year case need mail back tell low kolbalt shovel lifetime warranty question ask junk like every kolbalt tool buy hand apache shovel much much good kolbalt also lifetime warranty stamp metal impressive love give 5 star premature couple month use lot base weight price small foot step shovel b shovel go shovel sure would buy recommend
2495,B00004Z2HD,4,,Industrial_and_Scientific,quality staple replacement
2496,B000FC27TA,4,,Kindle_Store,good source obtain understanding thought precept communist dogma
2497,B00004Z5PF,5,,Office_Products,label great love label machine much easy constantly change paper printer put envelope label work wonderfully
2498,B0000CBJJL,5,,Home_and_Kitchen,make usa premium quality
2499,B0039GWDD4,5,,Patio_Lawn_and_Garden,beautiful large
2500,B00KQXKUJ2,5,,Video_Games,buy one friend love
2501,B000VJJQUU,5,,Musical_Instruments,happy sometime get pay
2502,B0011ZUSKU,5,,Digital_Music,already alright
2503,B00K7H3UP8,5,,Digital_Music,two lady top world must buy
2504,B004E2O6MI,5,,Office_Products,love black ink well price purchase near future thank much
2505,B000MHHDVK,5,,Grocery_and_Gourmet_Food,excellent product take work bag every morning highly recommended
2506,B00006IIVJ,4,,Video_Games,avid fan combat flight simulator 2 almost six month computer crash many cfs2 file lose miss disc 1 could reinstall game figure get bore anyway begin consider purchase third installment cf franchise first get game blow away first thirty second graphic game second program crash due overheat want game laptop consider get cooling pad put lot grief problem campaign mode game confusing living map action perform affect game game put cockpit fighter pilot usa britain germany well option bomber pilot switch gunner pilot bombardier mission three country win campaign kind understand happen world war ii whole concept change outcome war aside campaign mission builder obtain website google game enough design mission completely run away historical accuracy make absurdly intense mission highly reccomend fighter primarily grind attack mission game come much challenge change realism option much plane really behave like real plane stall speed ect make game quite challenge find run stuff forget always quick combat historical mainly early jet fighter dogfight keep entertain make sure always challenge new mission mission get pretty conclusion game really unique experience game self put world endless aerial scenario rock sock day day huge fan consult cfs3 forum really enhance game experience
2507,B005S4Y8TM,5,,Software,loyal turbotax user since 2003 easy thorough need home use affordable compare professional tax return service never problem instal software 8 year always perform reliably prepare flawless tax return ensure quick easy use relevant version report schedule c income program quickly easily calculate tax ensure get social security credit self employment give next year estimate tax payment well investment income feature download statement investment account priceless ability calculate short capital gain schedule scary form imagine yet breeze year year help turbotax automatic import brokerage think give program try thoroughly recommend life become lot easy enjoy refund
2508,B000BUQOCM,5,2,Automotive,tire drag hose use wand toilet spray hit face find tornado read review part review good like camco product purchase tornado lay part drill hole per instruction one reviewer say take fifteen minute install tornado right walk back garage get tool step nozzle break morning email camco explain ask could purchase nozzle want wait day reply suck buy another tornado kit finish installation afternoon receive reply camco explain could sell nozzle would send one free course reply thank good customer service etc receive replacement nozzle decide would install second one opposite end hold tank read really clean tank know take care put bag ice toilet travel scrub break loose thing dry stick tank drive addition article report camp site continuous drain black holding tank dump need prevent thing stick dry upon departure camp site attach clear 45 degree elbow dump end slinky dump waste attach separate flushing hose tornado connection slowly turn water sound like twin motor hum run tornado three five minute watch kind stuff come black hold tank hold tank smell good mine definitely decide get tornado read positive review get good point go wrong
2509,B0001YRFS0,5,,Clothing_Shoes_and_Jewelry,great pant guy everything one hand stroke year ago button almost impossible dicky metal hook clasp simple easy enough close one hand
2510,B0002E1NNC,4,,Musical_Instruments,set string great really like elixir string set sound really really bright even bass string metallic ring really like nit pick low e string sound weird round hit harmonic lose bright metallic ring really like string sound really really great
2511,B00KOOF5W0,4,,Industrial_and_Scientific,like visqueen like plastic
2512,B00TI55RQ0,1,,Pet_Supplies,arrive broken drive cant take return
2513,7197675,3,,Books,buy book expect exciting welch biography didnt find book boring
2514,B01E4QQ6QM,5,2,Gift_Cards,great gift idea sure recipient taste
2515,B002CPNTHM,1,2,Patio_Lawn_and_Garden,work spray sunny warm day lose time weed grow taller hope sunny weekend day apply weed killer
2516,B00005OTXY,5,,Home_and_Kitchen,work great deep frying easy clean
2517,B0017RCBK2,5,,Arts_Crafts_and_Sewing,work well hold nightly washing
2518,B0013D6RWS,5,,Digital_Music,awesome song christmas song bring worship thank lamb god group college age people church sign language routine song cry almost every time try find song go website lyric song actually song blaspheme lamb god thank kirk franklin family glorify lord savior
2519,7141424,5,,Books,usually book take adventure via course plot specific destination giver typical book simple story illustrate world strip manageable reality giver shimmer surface roil subterraneously narrator proxy reader slowly start see exist exist prism memory share wise man see life irretrievably change choice must make would choose therein lie gift lowry give
2520,B018QC8QQ8,4,,Patio_Lawn_and_Garden,fitting okay hopefully last awhile
2521,B00CW0O1EW,5,,Appliances,muti pack make sure always part finish job check hand
2522,B00000DF9J,5,,CDs_and_Vinyl,become fan young lady base upon number one hit lately knock sock cover george michael one try version rival original rare two factor think group go far music career one label red ant record also label salt pepa release last record file bankruptcy two compete group like 702 destiny child tlc get lose shuffle
2523,B008CLPMNO,4,,Automotive,instal jeep take slightly longer 15 minute immediately noticing gain fuel efficiency worth price
2524,B000163G8G,5,,Clothing_Shoes_and_Jewelry,simple comfortable favorite bra highly recommend smooth clothing durable recently buy amazon another one year wear day week still great shape even wear tank top strap thin feminine see
2525,B00007FGU7,5,,Electronics,work expect
2526,B001N4I7XE,5,62,Sports_and_Outdoors,love nice comfortable like sole look keep foot safe rock sharp object walk beach rock use yet real ocean scenario sure work fine put open heel diver fin fit perfect comfortable foot pocket talk fin akona caicos promate pace give idea size 11 shoe real foot size 10 like leave extra room comfort guess people read reviewes size peolpe say run large case follow advice get size 10 exact foot heel toe think need extra room type shoe guess run little big like case 10 real 10 feel snug comfortable great product case size like 10 10 11 11 9 9 etc
2527,B0009RF9DW,5,,All_Beauty,cream smell incredible make skin soft try coordinating hand cream massage cream love
2528,B007XZMKBW,5,,Kindle_Store,really enjoy book son cute rhyme good moral illustration also pretty cute
2529,B00VE96PUU,5,,Cell_Phones_and_Accessories,receive item satisfied customer
2530,B010O757HY,5,,Prime_Pantry,tasty
2531,B0083WMA4Q,5,,Digital_Music,earth wind fire certainly imo platinum standard musicianship vocal hear song eric benet certainly bring mind ewf classic way world one would almost swear either sample entire rhythm track song go wholesale commission ewf play tune check cd credit make sure philip bailey list background vocalist sure sound like sing merit eric benet stellar r b singer falsetto range rival great philip bailey ewf indeed benet friend colleague maurice white philip bailey entire ewf family philip bailey ever decide retire ewf benet would fit nicely replacement certainly get range vocal chop philip falsetto song ewf playlist particularly reason else besides eric benet could even hope justice ewf gem sure would like see eric benet ewf matter open digress single eric benet copy sample ewf flavor take whole pot stew add something uniquely recipe really cook work incredulous eric benet nominate 4 time yet win grammy material like one would think one two shelf right
2532,B00960JOW0,5,,Tools_and_Home_Improvement,take bit practice get rate speed right figure sealer excellent initial attempt figure proper speed start seal chip package seam plastic may bit tricky seal across still far best solution find seal snack similar bag
2533,B0002TOZ1E,3,2,Clothing_Shoes_and_Jewelry,like gold toe sock comfy bad pain tire pick little black piece lint carpet wo buy
2534,B0011RLVJA,5,2,Pet_Supplies,second purchase product get third three dog bad tartar buildup use twice day three week plaque dissolve even back teeth head another dental apt find really want due danger put well cost would highly recommend product use faithfully week head vet really happy
2535,4244079,2,,Books,weird paperback ever purchase amazon size large workbook inside blend different font margin inch definitely something want buy read curl couch seem like piece someone grab content online want make money little woman lovely book choose different version
2536,B000S5MW6C,5,2,Musical_Instruments,ibanez wd7 weep demon one versatile wah pedal ever stomp wah pedal pony weep demon new master wah pedal make wah sound need guitar love casing look awesome build like tank exterior weeping demon make almost entirely heavy duty metal look sort like aluminum mine several year barely mark despite stomp incessantly wah pedal power switch rocker love switch right side pedal plenty control need worry either miss button rock leave foot rocker free left side pedal lever flip towards front pedal standard mode rocker move freely effect control switch flip lever towards back pedal shift hardware auto wah mode auto wah mode heel pedal instantly drop toward base pedal take feel rather use switch activate pedal simply start use pedal automatically turn effect let pedal drop back place turn back delay desire rocker wavy rubber texture feel good shoe control sound three knob level q low frequency allow adjust character sound make small black switch change pedal guitar bass mode nice feature knob weeping demon click body pedal set keep get accidentally bump play additionally two knob foot rocker allow control character sound adjust delay pedal turn wah pedal negative impact sound poorly design wahs add bit noise hiss wah power weep demon completely silent wd7 power ac adaptor battery run standard 9v dc power supply plug stock connector pedalboard use spare adaptor another pedal pedal capable power others like bos tu series wd7 wah pedal rule
2537,B01953W0FU,5,,Toys_and_Games,jjrc h16 tarantula x6 drone 4ch 360 roll degree rc quadcopter without camera excellent drone work great big performance connection good work great excellent maneuver function great
2538,B00B6JLOJA,5,,Tools_and_Home_Improvement,oooof hit head wait hurt
2539,B000W08JQA,5,,Digital_Music,music continue remind past great
2540,B00004OCKR,4,,Home_and_Kitchen,really good manages remove load moisture veg work well iceberg lettuce wavy variety leaf
2541,B00EDSI8HW,4,,Software,take bit get use photographer also website designer cause pc often far microsoft window go really like xp also windows 7 however find vista hell present pc come window 8 take get use get groove complaint though find mite difficult adjust change opt program available retrograde window 7 feature fall category might wait month microsoft window 10 make debut understand include feature windows 7 user get use iteration window though hold additional change
2542,6302111099,4,,Movies_and_TV,something different george sander excellent cast interesting worth watching
2543,B004RMK57U,4,7,Video_Games,sure price go 60 experience always stellar see improvement worth 10 per year entire appreciate free game although time typically game would like play still prefer sony microsoft go need play friend playstation especially recommend find 40
2544,B000O5DI3W,5,,Pet_Supplies,two dog one health issue frequent dosing med really assist pill pocket
2545,B000XSF3YM,5,,Patio_Lawn_and_Garden,great reach easy clip inch branch saw nice option tough perform save money hire tree trimmer
2546,B00I4E91GI,5,,Automotive,great item great price
2547,630176031X,5,,Movies_and_TV,make wish viking
2548,B00004RG9F,5,,Home_and_Kitchen,6 qt 3 qt nice option
2549,B00M0V083Q,4,,Luxury_Beauty,dark spot face mostly pea size use week start notice color spot fade however skin around edge spot get slightly irritate cream pleasant faint smell rub smoothly absorbs quickly overall good fade spot use additional moisturizer area keep skin get
2550,B015MLLHI0,3,,Prime_Pantry,hard cookie hop soft version almost stale texture
2551,B000CSS8UE,4,,Industrial_and_Scientific,buy tape help put plastic weak window apartment black worked well hope come easy without pull paint
2552,B0000AI0N2,5,,Electronics,like way protect device without daisy chain light bar problem gadget need massive amount outlet plug make mess closet much nicer look
2553,B00BXLW5QC,5,7,Gift_Cards,gift card timely receive good condition properly credit amount indicate happy purchase
2554,B0009RF9DW,5,,All_Beauty,want
2555,B00004R90Y,5,,Home_and_Kitchen,love tortilla shell baker make taco salad shell quickly easily shell look great give pair son also impressed great purchase thanks amazon
2556,B00KYW1K26,5,,Grocery_and_Gourmet_Food,order good
2557,B000Q5NFJW,4,5,Prime_Pantry,like brand new england clam chowder much campbell version clam pretty near every spoonful yes lot potato like potato good soup
2558,B00BUKL666,5,,Grocery_and_Gourmet_Food,taste really good nice somethingto throw pocket nasty little high calorie
2559,B000K7EOBE,5,,Tools_and_Home_Improvement,love come fast perfect need size great want
2560,B0002HBOMO,5,,Office_Products,purchase cell phone mat boat find exhaustive review http work great cell phone slide around even encounter rough sea added bonus perfect fit boat cell phone din accessory tray price great mat look really nice work well sunglass item remove leave sticky residue added bonus
2561,B002K6AHQY,5,,Luxury_Beauty,perfect shade summer time year neutral go everything also show noticeable chip
2562,B017BGOM3G,5,,Prime_Pantry,daughter use everyday say wonderful gentle hair
2563,7202156,5,,Books,love video would like purchase hard back seem able
2564,B00008GKDN,5,,Home_and_Kitchen,nice solid iron griddle lodge make many good product reasonably price thing would change size expand diameter 12 inch
2565,B001IKJOLW,5,,AMAZON_FASHION,comfortable consistent time order good look
